id,alt_type,attack,card_bonus,number,command,cost,errata_text,faction,hit_points,keywords,loyalty,name,resource_bonus,shields,text,traits,type,unique,copies,cycle,designer,octgn_id,set,signature_id,starting_cards,starting_resources,planet_material,planet_stronghold,planet_tech,sector,tts_card_key,tts_sheet_id,tts_sheet_position,flavour_text
843,,,,128,,2,,Chaos,,,Loyal,Slaanesh's Temptation,,2,"Attach to a planet. Increase the cost of each enemy unit being deployed at another planet by 1. Forced Reaction: After a battle at attached planet ends, sacrifice this attachment.",Power. Slaanesh.,Attachment,yes,,Warlord Cycle,FFG,8982e329-c304-4705-9dae-63fd61dfad6f,The Descendants of Isha,,,,,,,,,,,
844,,,,129,,2,,Chaos,,,Loyal,Doom Siren,,2,"Attach to an army unit. Reaction: After attached unit uses its Area Effect ability, deal damage equal to its Area Effect value to each enemy unit at each adjacent planet. Then, sacrifice the attached unit.",Wargear. Slaanesh.,Attachment,,,Warlord Cycle,FFG,cda31d71-c497-4612-9e73-cac77570b4f5,The Descendants of Isha,,,,,,,,,,,
845,,3,,130,3,6,,Astra Militarum,5,No Wargear Attachments. Ranged.,,Shrieking Basilisk,,,"Reaction: After this unit damages an enemy unit, exhaust a target support card.",Vehicle. Artillery. Elite.,Army,,,Warlord Cycle,FFG,6f9bd9cc-9b00-4654-a7fe-330fbca5ddb5,The Descendants of Isha,,,,,,,,,,,
846,,,,131,,2,,Astra Militarum,,,Loyal,The Emperor's Warrant,,2,"Combat Action: Exhaust a target enemy unit at a planet without an enemy warlord. Then, deal damage equal to that unit's ATK value to another target unit at that planet.",Tactic.,Event,,,Warlord Cycle,FFG,fb6c4aa1-0b88-4841-9f94-90a34c659297,The Descendants of Isha,,,,,,,,,,,
847,,4,,132,1,4,,Tau,3,,,Vior'la Warrior Cadre,,,This unit gains Ranged while you control an Ethereal unit at this planet.,Soldier. Shas'la.,Army,,,Warlord Cycle,FFG,703d87a8-9f83-489d-b3eb-7a1ca635e53c,The Descendants of Isha,,,,,,,,,,,
848,,,,133,,2,,Tau,,,,For the Tau'va,,1,Action: Exhaust your warlord to ready each unit you control with 1 or more attachments.,Tactic. Maneuver.,Event,,,Warlord Cycle,FFG,bc59418a-bce0-44a9-8807-4faeaf7b49e7,The Descendants of Isha,,,,,,,,,,,
849,,3,,134,1,4,,Neutral,5,,,Inquisitor Caius Wroth,,,"Reaction: After this unit enters play, each player must choose and discard down to 4 cards in his hand, if able.",Psyker. Inquisitor.,Army,yes,,Warlord Cycle,FFG,94d226a4-4f8c-45ed-a9be-d1aca2d1d0ef,The Descendants of Isha,,,,,,,,,,,
850,,4,,1,1,5,,Space Marine,4,Deep Strike (3). Area Effect (1),Loyal,Belial,,,"Reaction: After you Deep Strike this unit, deal 1 damage to each enemy unit at this planet. Interrupt: When this unit would be destroyed by taking damage, sacrifice another Dark Angels army unit at this planet to put this unit into reserve at this planet or an adjacent planet and remove all damage from it instead.",Elite. Soldier. Dark Angel,Army,yes,,Black Crusade EP,BCL,934844da-9902-a429-926d-9061900dc200,The Eye of Terror,,,,,,,,,,,
851,,3,,2,1,3,,Space Marine,3,,,Wolf Guard Veteran,,,This unit gains Mobile while you control a Space Wolves unit at an adjacent planet.,Soldier. Space Wolves.,Army,,,Black Crusade EP,BCL,934844da-9902-a429-926d-9061900dc201,The Eye of Terror,,,,,,,,,,,
852,,,,3,,2,,Space Marine,,Deep Strike (1).,,Terminator Armour,,1,Attach to a [SM] Soldier army unit with printed cost 4 or lower. Limit 1 per unit. Attached unit gets +2 ATK and +2 HP. Attached unit gains the Elite trait.,Wargear. Armour.,Attachment,,,Black Crusade EP,BCL,934844da-9902-a429-926d-9061900dc202,The Eye of Terror,,,,,,,,,,,
853,,1,,4,2,3,,Astra Militarum,3,Area Effect (1). No Wargear Attachments.,,Fiery Heart Immolator,,,"Reaction: After this unit moves to a planet, deal 2 damage to a target non-warlord unit at that planet. (Limit twice per phase.)",Vehicle. Tank. Ecclesiarchy.,Army,,,Black Crusade EP,BCL,934844da-9902-a429-926d-9061900dc203,The Eye of Terror,,,,,,,,,,,
854,,2,,5,2,4,,Astra Militarum,3,No Wargear Attachments.,,Salamander Scout Vehicle,,,"Reaction: After this unit moves to a planet, put 1 Guardsman token into play at that planet. (Limit twice per phase.)",Vehicle. Tank.,Army,,,Black Crusade EP,BCL,934844da-9902-a429-926d-9061900dc204,The Eye of Terror,,,,,,,,,,,
855,,,,6,,2,,Astra Militarum,,,Loyal,We are the Guard,,2,"Combat Action: Ready a target Soldier or Warrior unit you control. If that unit is a non-[AM] unit, you may ready another Soldier or Warrior army unit or token at the same planet. Then all units you control gain the Soldier trait until the end of the round.",Tactic.,Event,,,Black Crusade EP,BCL,934844da-9902-a429-926d-9061900dc205,The Eye of Terror,,,,,,,,,,,
856,,2,,7,1,6,,Ork,6,,Loyal,Krakfang,,,"Mob Up! - While you control more [ORK] units at this planet than there are enemy units at this planet, [ORK] army units you control at this planet get +1 ATK. Combat Action: Deal 1 damage to an army unit you control at this planet then put 1 Snotling token into play at this planet. Limit once per combat round).",Nob. Warrior. Elite.,Army,yes,,Black Crusade EP,BCL,934844da-9902-a429-926d-9061900dc206,The Eye of Terror,,,,,,,,,,,
857,,,,8,,2,,Ork,,,,Rammin' Speed,,1,Combat Action: Sacrifice a Vehicle unit you control at a target planet to deal damage equal to the sacrificed unit's printed HP to a non-warlord unit at that planet.,Tactic.,Event,,,Black Crusade EP,BCL,934844da-9902-a429-926d-9061900dc207,The Eye of Terror,,,,,,,,,,,
858,,,,9,,0,,Ork,,,Loyal,Krump 'em,,2,"Reaction: When an army unit you control is declared as an attacker, deal 2 damage to it to give it Brutal for that attack. You may not declare a warlord as the defender for this attack (Max 1 per attack).",Tactic.,Event,,,Black Crusade EP,BCL,934844da-9902-a429-926d-9061900dc208,The Eye of Terror,,,,,,,,,,,
859,,4,,10,2,5,,Chaos,5,No Wargear Attachments.,Loyal,Juggernaut of Khorne,,,While your warlord is Bloodied this unit gains +4 HP and Brutal.,Deamon. Khorne. Elite.,Army,,,Black Crusade EP,BCL,934844da-9902-a429-926d-9061900dc209,The Eye of Terror,,,,,,,,,,,
860,,,,11,,1,,Chaos,,,,Bloodfeeder,,1,"Attach to a Khorne unit. Limit 1 per unit. Attached unit gets +1 ATK. If attached unit is a Bloodied warlord it instead gets +2 HP. Reaction: After a unit is destroyed at this planet, exhaust this card to remove up to 2 damage from attached unit.",Wargear. Weapon. Khorne.,Attachment,,,Black Crusade EP,BCL,934844da-9902-a429-926d-9061900dc210,The Eye of Terror,,,,,,,,,,,
861,,,,12,,1,,Chaos,,,Loyal,Cower Before Me!,,2,Reaction: After your warlord commits to a planet deal X damage to a target non-warlord unit at that planet. X is the printed ATK value of a non-Elite Khorne unit you control at that planet.,Tactic. Khorne.,Event,,,Black Crusade EP,BCL,934844da-9902-a429-926d-9061900dc211,The Eye of Terror,,,,,,,,,,,
862,,2,,13,1,3,,Dark Eldar,3,Deep Strike (2).,Loyal,The Carver,,,"Reaction: After you Deep Strike this unit, exhaust it to deal damage equal to the number of Torture cards in your discard pile to a target army unit at this planet. Reaction: After you play a Torture event, put this unit into reserve at this or an adjacent planet.",Raider. Haemonculus.,Army,yes,,Black Crusade EP,BCL,934844da-9902-a429-926d-9061900dc212,The Eye of Terror,,,,,,,,,,,
863,,3,,14,1,3,,Dark Eldar,3,,,Vile Creation,,,"Interrupt: When this unit is destroyed, gain X resources (up to a maximum of 4). X is the number of Torture cards in your discard pile.",Abomination,Army,,,Black Crusade EP,BCL,934844da-9902-a429-926d-9061900dc213,The Eye of Terror,,,,,,,,,,,
864,,1,,15,1,2,,Dark Eldar,2,,,Unwilling Slave,,,"Reaction: After you play a Torture event, sacrifice this unit to return that event from your discard pile to your hand.",Slave,Army,,,Black Crusade EP,BCL,934844da-9902-a429-926d-9061900dc214,The Eye of Terror,,,,,,,,,,,
865,,2,,16,1,3,,Eldar,3,Mobile.,,Swooping Hawk Autarch,,,"Reaction: After this unit moves from one planet to another, deploy an attachment from your hand to an eligible unit at this planet.",Warrior,Army,,,Black Crusade EP,BCL,934844da-9902-a429-926d-9061900dc215,The Eye of Terror,,,,,,,,,,,
866,,2,,17,1,2,,Eldar,2,,Loyal,Saim-Hann Seer,,,"Action: Choose an enemy unit at this planet. That unit loses all printed keywords until the end of the round. Then, this unit gains all keywords lost as a result of this effect until the end of the round. (Limit once per round).",Psyker. Saim-Hann.,Army,,,Black Crusade EP,BCL,934844da-9902-a429-926d-9061900dc216,The Eye of Terror,,,,,,,,,,,
867,,,,18,,1,,Eldar,,,Loyal,Lasblaster,,2,"Attach to a Mobile army unit. Attached unit gets +2 ATK. Reaction: After attached unit moves from one planet to another, it gain Ranged until the end of the phase.",Wargear. Weapon.,Attachment,,,Black Crusade EP,BCL,934844da-9902-a429-926d-9061900dc217,The Eye of Terror,,,,,,,,,,,
868,,1,,19,1,2,,Tau,3,,Loyal,Shield Drone,,,Each other non-Elite unit you control at this planet with 1 or more attachments gains 'Cannot be targeted by enemy card effects.',Drone.,Army,,,Black Crusade EP,BCL,934844da-9902-a429-926d-9061900dc218,The Eye of Terror,,,,,,,,,,,
869,,2,,20,1,3,,Tau,2,Deep Strike (1).,,Pathfinder Cadre,,,"Reaction: After you Deep Strike this unit, move an attachment you control from one unit to another eligible unit.",Scout.,Army,,,Black Crusade EP,BCL,934844da-9902-a429-926d-9061900dc219,The Eye of Terror,,,,,,,,,,,
870,,,,21,,2,,Tau,,Limited.,,Gue'vesa Reinforcements,,,Combat Action: Exhaust and sacrifice this support to put 3 Guardsman tokens into play at a planet where you control 1 or more [AM] army units.,Upgrade.,Support,,,Black Crusade EP,BCL,934844da-9902-a429-926d-9061900dc220,The Eye of Terror,,,,,,,,,,,
871,,,,22,,0,,Tyranid,,,,Behemoth Hive Ship,,,"Interrupt: When you deploy a [TYR] unit with the Hive Mind specialization, exhaust this support to reduce that unit's cost by 1.",Upgrade,Support,yes,,Black Crusade EP,BCL,934844da-9902-a429-926d-9061900dc221,The Eye of Terror,,,,,,,,,,,
872,,1,,23,1,1,,Tyranid,1,,,Hellgaunt,,,While this unit is at an infested planet it gets +1 ATK and +2 HP.,Creature. Leviathan. Termagaunt.,Army,,,Black Crusade EP,BCL,934844da-9902-a429-926d-9061900dc222,The Eye of Terror,,,,,,,,,,,
873,,,,24,,0,,Tyranid,,,,Strip the Planet Dry,,1,Reaction: After winning a battle at the first planet gain 2 [Resource]. If that planet is infested gain an additional 2 [Resource]. (Max 1 per round).,Tactic.,Event,,,Black Crusade EP,BCL,934844da-9902-a429-926d-9061900dc223,The Eye of Terror,,,,,,,,,,,
874,,5,,25,3,6,,Tyranid,5,,,Subject M17c1-1,,,"Reaction: After you deploy this unit, put 1 termagant token into play at this planet. Reaction: After an enemy army unit at this planet is declared as an attacker, deal damage equal to its ATK value to a unit of your choice that you control at this planet. Cancel the remainder of the attack. (Limit once per phase).",Hive Tyrant. Behemoth. Elite.,Army,yes,,Black Crusade EP,BCL,934844da-9902-a429-926d-9061900dc224,The Eye of Terror,,,,,,,,,,,
875,,2,,26,1,2,,Necron,2,,,Harbringer of the Storm,,,"Reaction: After you deploy this unit, you may set your enslavement dial to another faction.",Scholar,Army,,,Black Crusade EP,BCL,934844da-9902-a429-926d-9061900dc225,The Eye of Terror,,,,,,,,,,,
876,,,,27,,0,,Necron,,,,Living Metal,,,"Reaction: After a [NEC] unit is assigned damage, sacrifice this support to prevent up to 5 of that damage.",Upgrade.,Support,,,Black Crusade EP,BCL,934844da-9902-a429-926d-9061900dc226,The Eye of Terror,,,,,,,,,,,
877,,,,28,,2,,Necron,,,,Raid the Grave,,,"Play only during a battle. Combat Action: Put the topmost army unit from your opponent's discard pile into play under your control at a planet. If that unit is still in play at the end of the phase, discard it. (Max once per phase.)",Power.,Event,,,Black Crusade EP,BCL,934844da-9902-a429-926d-9061900dc227,The Eye of Terror,,,,,,,,,,,
878,,,,29,,1,,Necron,,,,Revitalize,,2,"Reaction: After you remove damage from a unit you control, that unit get +1 ATK and gains Armorbane until the end of the phase.",Tactic.,Event,,,Black Crusade EP,BCL,934844da-9902-a429-926d-9061900dc228,The Eye of Terror,,,,,,,,,,,
879,,,1,175,,,,,,,,Plannum,1,,Battle: Move a non-warlord unit you control to a planet of your choice.,,Planet,,,Markers and Planets,FFG,5e423620-6663-4198-8cdc-df0fabf876c8,Markers and Planets,,,,,1,1,Traxis Sector,,,,
880,,,1,176,,,,,,,,Atrox Prime,1,,Battle: Deal 1 damage to each enemy unit at a target HQ or adjacent planet.,,Planet,,,Markers and Planets,FFG,12fea3b0-be4e-4142-89db-316c56956c8f,Markers and Planets,,,,1,,1,Traxis Sector,,,,
881,,,2,177,,,,,,,,Barlus,0,,Battle: Discard 1 card at random from your opponent's hand.,,Planet,,,Markers and Planets,FFG,89b18d3e-431e-4889-94d1-0948f73a4b2a,Markers and Planets,,,,,1,,Traxis Sector,,,,
882,,,2,178,,,,,,,,Elouith,0,,"Battle: Search the top 3 cards of your deck for a card. Add it to your hand, and place the remaining cards on the bottom of your deck in any order.",,Planet,,,Markers and Planets,FFG,9657b143-06c2-45fe-bd6e-4a3d131e1689,Markers and Planets,,,,,,1,Traxis Sector,,,,
883,,,1,179,,,,,,,,Carnath,1,,Battle: Trigger the Battle ability of another planet in play.,,Planet,,,Markers and Planets,FFG,8ec7354b-eef5-4997-82ed-d7ed66a93c15,Markers and Planets,,,,1,,1,Traxis Sector,,,,
884,,,1,180,,,,,,,,Tarrus,1,,"Battle: If you control fewer units than your opponent, gain 3[RESOURCE] or draw 3 cards.",,Planet,,,Markers and Planets,FFG,8fcab463-9c8c-4745-a49e-38f56bc49e6d,Markers and Planets,,,,1,1,,Traxis Sector,,,,
885,,,0,181,,,,,,,,Osus IV,2,,Battle: Take 1 [RESOURCE] from your opponent.,,Planet,,,Markers and Planets,FFG,1a35a54a-0f21-44d0-ab40-b3ec7ac5cadc,Markers and Planets,,,,,1,,Traxis Sector,,,,
886,,,0,182,,,,,,,,Ferrin,2,,Battle: Rout a target non-warlord unit.,,Planet,,,Markers and Planets,FFG,e0c7e2e6-711d-4704-8e38-182d113c6282,Markers and Planets,,,,1,,,Traxis Sector,,,,
887,,,0,183,,,,,,,,Y'varn,1,,Battle: Each player puts a unit into play from his hand at his HQ.,,Planet,,,Markers and Planets,FFG,3e58dd21-00fe-499e-87e9-7bb52bb66b95,Markers and Planets,,,,1,1,1,Traxis Sector,,,,
888,,,1,184,,,,,,,,Iridial,0,,Battle: Remove all damage from a target unit.,,Planet,,,Markers and Planets,FFG,36221c3a-591c-41e8-a4c9-fc71c89cac12,Markers and Planets,,,,1,1,1,Traxis Sector,,,,
889,,,,,,,,,,,,Servo-Skull,,,,,Skull,,,Markers and Planets,FFG,5c352ba9-9b70-4071-ae47-e2bed96d1e01,Markers and Planets,,,,,,,,,,,
890,,,,,,,,,,,,Tyra-Skull,,,,,Skull,,,Markers and Planets,FFG,124d3e0b-621a-4eb7-bb34-e4163794989f,Markers and Planets,,,,,,,,,,,
891,,,,,,,,,,,,Syna-Skull,,,,,Skull,,,Markers and Planets,FFG,a53b9f48-6ae2-4cd7-ba8a-6bfcf47bca3c,Markers and Planets,,,,,,,,,,,
892,,,,,,,,,,,,Initiative Token,,,,,Initiative,,,Markers and Planets,FFG,29133845-cfae-4d83-ba1b-8c7dc3dbbabe,Markers and Planets,,,,,,,,,,,
893,,1,,186,,,,Astra Militarum,2,,,Guardsman,,,,Soldier.,Token,,,Markers and Planets,FFG,68be9030-f0db-4e9f-942f-77b91d115f24,Markers and Planets,,,,,,,,,,,
894,,1,,185,,,,Ork,1,,,Snotlings,,,,Runt.,Token,,,Markers and Planets,FFG,177f3172-7098-4732-868e-afc9f0fb62fa,Markers and Planets,,,,,,,,,,,
895,,1,,187,,,,Chaos,1,,,Cultist,,,"Interrupt: When you deploy a Daemon unit, sacrifice this unit to reduce its cost by 1.",Cultist.,Token,,,Markers and Planets,FFG,532ecbb0-37cc-4805-a88e-5fd8495acbea,Markers and Planets,,,,,,,,,,,
896,,2,,188,,,,Dark Eldar,1,No Attachments.,,Khymera,,,,Creature.,Token,,,Markers and Planets,FFG,85f78832-49b5-4733-9315-7490c54132ec,Markers and Planets,,,,,,,,,,,
897,,1,,64,,,,Tyranid,1,,,Termagant,,,,Creature. Termagant.,Token,,,Markers and Planets,FFG,36d606a9-3d24-441e-87f1-b5ed9aea5bce,Markers and Planets,,,,,,,,,,,
898,bloodied,2,,1,,,,Space Marine,5,Bloodied.,Signature,Captain Cato Sicarius,,,,Soldier. Ultramarines.,Warlord,yes,,Core Set,FFG,,Core Set,,,,,,,,,,,
899,,2,,1,,,,Space Marine,6,,Signature,Captain Cato Sicarius,,,"Reaction: After an enemy unit at this planet is destroyed, gain 1 [RESOURCE].",Soldier. Ultramarines.,Warlord,yes,,Core Set,FFG,d8a1bb05-2b03-405b-aa32-4549b2d1d020,Core Set,1,7,7,,,,,,,,
900,bloodied,2,,2,,,,Astra Militarum,5,Bloodied.,Signature,Colonel Straken,,,,Soldier. Catachan.,Warlord,yes,,Core Set,FFG,,Core Set,,,,,,,,,,,
901,,2,,2,,,,Astra Militarum,6,,Signature,Colonel Straken,,,Each other Soldier or Warrior unit you control at this planet gets +1 ATK.,Soldier. Catachan.,Warlord,yes,,Core Set,FFG,44aad991-102f-4f6a-a826-16a02f2bd75c,Core Set,2,7,7,,,,,,,,
902,bloodied,2,,3,,,,Ork,5,Bloodied.,Signature,Nazdreg,,,,Warrior. Warboss.,Warlord,yes,,Core Set,FFG,,Core Set,,,,,,,,,,,
903,,2,,3,,,,Ork,7,,Signature,Nazdreg,,,Each other unit you control at this planet gains Brutal.,Warrior. Warboss.,Warlord,yes,,Core Set,FFG,efb52dfe-ede5-41aa-97ce-2f4e5e8d562c,Core Set,3,7,7,,,,,,,,
904,bloodied,1,,4,,,,Chaos,5,Bloodied.,Signature,"Zarathur, High Sorcerer",,,,Psyker. Tzeentch.,Warlord,yes,,Core Set,FFG,,Core Set,,,,,,,,,,,
905,,1,,4,,,,Chaos,6,,Signature,"Zarathur, High Sorcerer",,,"Interrupt: When damage is assigned to an enemy unit at this planet, increase that damage by 1.",Psyker. Tzeentch.,Warlord,yes,,Core Set,FFG,c8ef7c23-ccb4-487b-a357-2da397c5ef79,Core Set,4,7,7,,,,,,,,
906,bloodied,1,,5,,,,Dark Eldar,5,Bloodied.,Signature,Packmaster Kith,,,,Warrior. Succubus. Wych.,Warlord,yes,,Core Set,FFG,,Core Set,,,,,,,,,,,
907,,2,,5,,,,Dark Eldar,6,,Signature,Packmaster Kith,,,"Reaction: After this warlord commits to a planet, put a Khymera token into play at this planet.",Warrior. Succubus. Wych.,Warlord,yes,,Core Set,FFG,296b5042-953c-4164-a7c5-6b598ae6f439,Core Set,5,7,7,,,,,,,,
908,bloodied,1,,6,,,,Eldar,6,Bloodied.,Signature,Eldorath Starbane,,,,Psyker. Alaitoc.,Warlord,yes,,Core Set,FFG,,Core Set,,,,,,,,,,,
909,,1,,6,,,,Eldar,7,,Signature,Eldorath Starbane,,,"Reaction: After this warlord commits to a planet, exhaust a target non-warlord unit at that planet.",Psyker. Alaitoc.,Warlord,yes,,Core Set,FFG,68c515b1-a97a-4246-8de5-873a23f6fe0e,Core Set,6,7,7,,,,,,,,
910,bloodied,1,,7,,,,Tau,5,Bloodied.,Signature,Commander Shadowsun,,,,Soldier. Shas'o.,Warlord,yes,,Core Set,FFG,,Core Set,,,,,,,,,,,
911,,1,,7,,,,Tau,7,,Signature,Commander Shadowsun,,,"Reaction: After this warlord commits to a planet, put a [TAU] attachment with printed cost 2 or lower or 'Shadowsun's Stealth Cadre' from your hand or discard pile into play attached to an eligible unit at this planet.",Soldier. Shas'o.,Warlord,yes,,Core Set,FFG,dca1c8cd-4d4f-4414-9cf1-91554571b689,Core Set,7,7,7,,,,,,,,
912,,2,,8,1,3,,Space Marine,3,,Signature,Sicarius's Chosen,,,"Reaction: After this unit enters play, move a target enemy army unit at an adjacent planet to this planet and deal it 1 damage.",Soldier. Ultramarines.,Army,,4,Core Set,FFG,238ef37b-aed9-4e29-943a-173654955fe8,Core Set,1,,,,,,,,,,
913,,,,9,,2,,Space Marine,,,Signature,Cato's Stronghold,,,"Reaction: After an enemy unit is destroyed, exhaust this support to ready a target [SPACE MARINE] unit at the same planet.",Location.,Support,,1,Core Set,FFG,b7e2135b-2e04-4d0b-a448-d548c1c5f4e8,Core Set,1,,,,,,,,,,
914,,,,10,,2,,Space Marine,,,Signature,The Fury of Sicarius,,1,"Reaction: After a [SPACE MARINE] unit damages an enemy non-warlord unit by an attack, destroy the attacked unit.",Tactic.,Event,,2,Core Set,FFG,062ac44d-4e71-4d41-b60e-72df94e71eb6,Core Set,1,,,,,,,,,,
915,,,,11,,1,,Space Marine,,,Signature,Tallassarian Tempest Blade,,3,Limit 1 [R]elic per player. Attach to a unique unit. Attached unit gets +1 ATK and gains Armorbane.,Relic. Weapon.,Attachment,yes,1,Core Set,FFG,c6e6862d-85f3-4666-882c-ef7ec333c392,Core Set,1,,,,,,,,,,
916,,2,,12,1,1,,Space Marine,1,,,10th Company Scout,,,,Scout. Ultramarines.,Army,,,Core Set,FFG,a7ca6ea4-819d-4892-88e5-9af7187f632f,Core Set,,,,,,,,,,,
917,,1,,13,1,2,,Space Marine,3,Area Effect (1).,,Tactical Squad Cardinis,,,,Soldier. Ultramarines.,Army,,,Core Set,FFG,c2064bcf-4093-4b6d-bfc5-dceb167e94a3,Core Set,,,,,,,,,,,
918,,4,,14,1,3,,Space Marine,2,,Loyal,Honored Librarian,,,Enemy units cannot attack this unit while you control a unit not named 'Honored Librarian' at this planet.,Psyker. Ultramarines.,Army,,,Core Set,FFG,bd682398-d9eb-4815-9e7b-f1bc479c752e,Core Set,,,,,,,,,,,
919,,3,,15,1,3,,Space Marine,3,,,Blood Angels Veterans,,,"While this unit is ready, it gains, 'Reaction: After this unit is assigned damage, prevent 1 of that damage.'",Soldier. Blood Angels.,Army,,,Core Set,FFG,4447cbf3-de37-40a6-92a1-17cc885f85be,Core Set,,,,,,,,,,,
920,,3,,16,1,4,,Space Marine,3,Area Effect (2).,,Daring Assault Squad,,,,Soldier. Blood Angels.,Army,,,Core Set,FFG,0e95550a-d75e-4e3c-b1c2-c464c7a167dc,Core Set,,,,,,,,,,,
921,,3,,17,3,5,,Space Marine,7,No Wargear Attachments.,,Land Raider,,,Non-Vehicle units you control at this planet cannot be targeted by enemy card abilities.,Vehicle. Tank. Elite.,Army,,,Core Set,FFG,463ac586-1979-49cb-8e1e-f41e40991baf,Core Set,,,,,,,,,,,
922,,8,,18,,6,,Space Marine,8,No Wargear Attachments.,Loyal,Ultramarines Dreadnought,,,,Vehicle. Ultramarines. Elite.,Army,,,Core Set,FFG,af63c352-05a5-4991-a5c1-15b3d24f67dd,Core Set,,,,,,,,,,,
923,,2,,19,2,3,,Space Marine,3,,Loyal,Veteran Brother Maxos,,,Combat Action: Pay the printed cost of a [SPACE MARINE] unit in your hand to put it into play at this planet.,Soldier. Ultramarines.,Army,yes,,Core Set,FFG,4f94a309-2bfa-4f0d-b3a4-616815deb316,Core Set,,,,,,,,,,,
924,,2,,20,,1,,Space Marine,1,Ambush.,,Eager Recruit,,,,Scout. Ultramarines.,Army,,,Core Set,FFG,30cf32f0-c024-4a15-9390-8f291f6cc64b,Core Set,,,,,,,,,,,
925,,1,,21,1,3,,Space Marine,3,,,Iron Hands Techmarine,,,This unit gains 1 command icon for each enemy unit at this planet.,Soldier. Iron Hands.,Army,,,Core Set,FFG,75bd7d73-c8b3-41e9-9de1-93b17bdb4e25,Core Set,,,,,,,,,,,
926,,3,,22,2,4,,Space Marine,3,No Wargear Attachments. Flying.,,Raven Guard Speeder,,,,Vehicle. Raven Guard.,Army,,,Core Set,FFG,481fcfd4-2874-4b43-b0c4-be43fc24894f,Core Set,,,,,,,,,,,
927,,2,,23,4,5,,Space Marine,9,,Loyal,Deathwing Guard,,,,Soldier. Dark Angels. Elite.,Army,,,Core Set,FFG,1a4c669a-2eff-4f33-9580-d49e820b76cc,Core Set,,,,,,,,,,,
928,,,,24,,2,,Space Marine,,,Loyal,Drop Pod Assault,,2,"Combat Action: Target a planet where a battle is taking place. Search the top 6 cards of your deck for a [SPACE MARINE] unit with printed cost 3 or lower. Put that unit into play at the targeted planet, and place the remaining cards on the bottom of your deck in any order.",Tactic.,Event,,,Core Set,FFG,57654a17-cd12-456b-9379-00b5b87de36a,Core Set,,,,,,,,,,,
929,,,,25,,1,,Space Marine,,,,Indomitable,,1,"Reaction: After a [SPACE MARINE] unit is assigned damage by an attack, prevent all of that damage.",Power.,Event,,,Core Set,FFG,9bb7fee7-1b1a-4e4a-acf1-d7deb14b6c7d,Core Set,,,,,,,,,,,
930,,,,26,,3,,Space Marine,,,,Exterminatus,,1,Deploy Action: Destroy all non-unique units at a target non-first planet.,Tactic.,Event,,,Core Set,FFG,9ba6f965-7bb0-44d2-af8a-54175399a3c8,Core Set,,,,,,,,,,,
931,,,,27,,1,,Space Marine,,,,Godwyn Pattern Bolter,,1,"Attach to an army unit. Attached unit gets +1 ATK, +1 HP, and ignores the Flying keyword on enemy units while it is attacking.",Wargear. Weapon.,Attachment,,,Core Set,FFG,e9cf7f6e-35e9-4a66-8344-856598da5b10,Core Set,,,,,,,,,,,
932,,,,28,,3,,Space Marine,,,Loyal,Iron Halo,,2,"Limit 1 [R]elic per player. Attach to a unique unit. Reaction: After attached unit is assigned damage by an attack, exhaust this attachment to prevent all of that damage.",Relic. Wargear.,Attachment,,,Core Set,FFG,2fd923cf-a639-4b47-bbc3-91cfddf429d6,Core Set,,,,,,,,,,,
933,,,,29,,1,,Space Marine,,Limited.,,Fortress-Monastery,,,"Interrupt: When you deploy a [SPACE MARINE] unit, exhaust this support to reduce that unit's cost by 1.",Location.,Support,yes,,Core Set,FFG,588b2aa8-d5ab-4887-be7a-707d3db16775,Core Set,,,,,,,,,,,
934,,,,30,,2,,Space Marine,,,,Holy Sepulchre,,,"Reaction: After a [SPACE MARINE] unit enters your discard pile from play, exhaust this support to return that unit to your hand.",Location.,Support,,,Core Set,FFG,3f8c1ccf-0b50-4931-8eca-2e72832ff8f5,Core Set,,,,,,,,,,,
935,,2,,31,1,2,,Astra Militarum,2,,Signature,Straken's Command Squad,,,"Interrupt: When this unit leaves play, put a Guardsman token into play at the same planet.",Soldier. Catachan.,Army,,4,Core Set,FFG,5a51f6fc-80ba-4888-b1c7-562301f5c55b,Core Set,2,,,,,,,,,,
936,,,,32,,2,,Astra Militarum,,,Signature,Omega Zero Command,,,"Reaction: After you win a command struggle, put a Guardsman token into play at that planet.",Location.,Support,,1,Core Set,FFG,9f3c57be-cd85-4204-9a24-8ebea32491db,Core Set,2,,,,,,,,,,
937,,,,33,,1,,Astra Militarum,,,Signature,Glorious Intervention,,1,"Reaction: Reaction: After a unit is assigned damage by an attack, sacrifice a Soldier or Warrior unit at the same planet to prevent all of that damage. Then, deal X damage to the attacker. X is the sacrificed unit's printed ATK value.",Tactic.,Event,,2,Core Set,FFG,f90b98e7-20ac-405d-86d6-d3b67fc7b5f3,Core Set,2,,,,,,,,,,
938,,,,34,,1,,Astra Militarum,,,Signature,Straken's Cunning,,3,"Attach to an army unit. Attached unit gets +1 ATK. Interrupt: When attached unit leaves play, draw 3 cards.",Skill.,Attachment,,1,Core Set,FFG,00229e5d-e1c4-41b7-9f3b-11ab6e893255,Core Set,2,,,,,,,,,,
939,,1,,35,1,1,,Astra Militarum,1,Ranged.,,Ratling Deadeye,,,,Scout. Abhuman.,Army,,,Core Set,FFG,9f84295c-aae1-46c9-84c5-dd366d0e5aa6,Core Set,,,,,,,,,,,
940,,1,,36,2,3,,Astra Militarum,3,Ranged.,Loyal,Cadian Mortar Squad,,,"Reaction: After an army unit you control at this planet leaves play, ready this unit.",Soldier. Cadia.,Army,,,Core Set,FFG,4134faa4-24ab-4845-b3a7-c86b28cb8fcc,Core Set,,,,,,,,,,,
941,,0,,37,2,2,,Astra Militarum,4,,,Sanctioned Psyker,,,,Psyker.,Army,,,Core Set,FFG,046489fb-1431-46ed-b14b-76b72912b869,Core Set,,,,,,,,,,,
