id,alt_type,attack,card_bonus,number,command,cost,errata_text,faction,hit_points,keywords,loyalty,name,resource_bonus,shields,text,traits,type,unique,copies,cycle,designer,octgn_id,set,signature_id,starting_cards,starting_resources,planet_material,planet_stronghold,planet_tech,sector,tts_card_key,tts_sheet_id,tts_sheet_position,flavour_text
500,,,,45,,1,,Ork,,,Signature,Fake Ooman Base,,,"Reaction: After an [Ork] Soldier army unit you control is chosen as a defender, exhaust this support and move that unit to your HQ to cancel the attack.",Location.,Support,,1,Navida Prime,APK,9e1ddf09-0ee4-42d7-b59f-f96f5ac204fa,Enemy Territory,34,,,,,,,,,,
501,,2,,46,,3,,Space Marine,4,Deep Strike (2).,,Deathwing Interceders,,,"Interrupt: When an enemy unit would declare an attack against a unit you control at this planet, Deep Strike this unit to declare it as the defender instead. If this unit is still in play at the end of the phase, return it to your hand.",Soldier. Dark Angels.,Army,,,Navida Prime,APK,218f8763-71fe-47d4-96a0-3ffb8b07c55a,Enemy Territory,,,,,,,,,,,
502,,3,,47,1,3,,Astra Militarum,3,,Loyal,Celestian Amelia,,,"Reaction: After an enemy unit is declared as an attacker at this planet, while that unit is attacking, reduce all damage taken by other [AM] units you control to 1. (Limit once per phase.)",Soldier. Martyr. Ecclesiarchy.,Army,yes,,Navida Prime,APK,056ee6a3-5c5e-4fec-a8a1-82280f9dc674,Enemy Territory,,,,,,,,,,,
503,,2,,48,1,3,,Astra Militarum,3,No Wargear attachments.,,Hydra Flak Tank,,,"This unit deals double damage to enemy Flying or Mobile units. Reaction: After a unit moves to or from this planet, deal it 1 damage. (Limit once per phase.)",Vehicle. Tank. Krieg.,Army,,,Navida Prime,APK,275c2531-03a4-4a28-8546-0e262e5c6eb5,Enemy Territory,,,,,,,,,,,
504,,,,49,,1,,Eldar,,,Loyal,Lost in the Webway,,2,Action: Either (choose one): Switch the location of two Harlequin units you control or your opponent must switch the location of two army units he controls.,Power. Harlequin.,Event,,,Navida Prime,APK,3e332e62-1c8a-4dc9-a3bd-fda75acaeaad,Enemy Territory,,,,,,,,,,,
505,,,,50,,1,,Ork,,,,Sneaky Lootin',,1,"Reaction: After an [Ork] Soldier unit you control damages an enemy unit by an attack, move that unit to your HQ to gain 3 [C].",Tactic.,Event,,,Navida Prime,APK,ba75533a-0777-4a72-b815-a0a1153edd2b,Enemy Territory,,,,,,,,,,,
506,,3,,51,1,2,,Ork,2,Deep Strike (1),,Patient Infiltrator,,,"You may Deep Strike this card as an Action during the combat phase. Reaction: When you Deep Strike this unit, ready it and move up to 1 damage from this unit to a target unit at the same planet.",Soldier.,Army,,,Navida Prime,APK,b5e7ff2f-3ab3-4375-9eb4-dfb1588be8f5,Enemy Territory,,,,,,,,,,,
507,,,,52,,2,,Chaos,,Deep Strike (1),,Improvised Minefield,,1,"Attach to a planet. Forced Reaction: After a non-warlord unit is declared as an attacker at this planet, deal 3 damage to it and discard this card.",Location.,Attachment,,,Navida Prime,APK,9ffb7d20-0a9e-46ef-a6ca-ef9f24b85038,Enemy Territory,,,,,,,,,,,
508,,,,53,,1,,Tau,,,Loyal,Smuggler's Den,,,Action: Exhaust this support and pay 1 [C] to return a target attachment you control to your hand. Then gain [C] equal to the printed cost of the attachment.,Location.,Support,yes,,Navida Prime,APK,80ca1a23-d1e6-4bdd-a00b-3beb5cc18e83,Enemy Territory,,,,,,,,,,,
509,,,,54,,0,,Tau,,,,Consumed by the Kindred,,1,Action: Exhaust a Kroot unit and sacrifice another non-Vehicle unit to gain [C] equal to the sacrified unit printed cost.,Tactic. Kroot.,Event,,,Navida Prime,APK,12b745c9-682f-4e6e-b1cd-7c462e22ed09,Enemy Territory,,,,,,,,,,,
510,,4,,55,,2,,Dark Eldar,4,,,Mindless Pain Addict,,,"Cannot retreat or be routed. Reaction: When an army unit you control at this planet is destroyed, take control of this unit. Any player may use this ability.",Creature. Haemonculus.,Army,,,Navida Prime,APK,9138af1c-378d-4cd5-9476-622cd25fe3a5,Enemy Territory,,,,,,,,,,,
511,,,,56,,1,,Dark Eldar,,,,Supply Line Incursion,,1,"Action: Exhaust target support. Then, if that support is a Limited card, draw one card and gain 1 [C].",Tactic.,Event,,,Navida Prime,APK,8cadb2c8-37aa-4397-b357-e4b324a4e5c2,Enemy Territory,,,,,,,,,,,
512,,,,57,,1,,Tyranid,,,,Contaminated Convoys,,1,"Reaction: After a phase begins, until the end of this phase, when an enemy army unit enters play at a planet, put a Termagant token into play at the same planet and infest it.",Tactic.,Event,,,Navida Prime,APK,4a828f68-fdee-457d-a8a4-55c0aca5b2aa,Enemy Territory,,,,,,,,,,,
513,,,,58,,0,,Tyranid,,,,Hive Ship Tendrils,,,"Reaction: After a unit you control with the Hive Mind specialization leaves play, put an infestation token on this support. Then you may sacrifice this support to put a unit with the Hive Mind specialization and printed cost lower or equal to the number of tokens on this support into play from your discard pile at a planet.",Location.,Support,,,Navida Prime,APK,0a24294c-aeed-41a5-ad91-35040a3cb5c0,Enemy Territory,,,,,,,,,,,
514,,,,59,,1,,Necron,,,,Necrodermis,,2,"Play only during a battle. Interrupt: When your warlord would be defeated by taking damage, remove all damage from it instead. At the end of the phase or when another event named 'Necrodermis' is played, you lose the game.",Tactic.,Event,,,Navida Prime,APK,3ae585e3-21ae-4c92-927e-df3fea258746,Enemy Territory,,,,,,,,,,,
515,,2,,60,1,3,,Necron,3,,,Tomb Blade Diversionist,,,"Reaction: After an enemy army unit resolves an attack at this planet, if this unit wasn't chosen as a defender, deal 1 damage to the attacker.",Vehicle.,Army,,,Navida Prime,APK,9cbd4f74-ca90-4d7a-9a50-cb89637eebcc,Enemy Territory,,,,,,,,,,,
516,bloodied,2,,61,,,,Dark Eldar,5,Bloodied.,Signature,Liatha,,,,Assassin. Wych.,Warlord,yes,,,,,,,,,,,,,,,,
517,,2,,61,,,,Dark Eldar,7,,Signature,Liatha,,,"Cards in your hand may be used as shield cards with 2 shield icons. When you use a card this way, remove it from the game face-down. As an interrupt your opponent may have you turn the card face-up, if it is a card with 2 printed shield icons, deal 1 unpreventable damage to a unit. If not, cancel that card's shielding effect. (Limit three times per phase.)",Assassin. Wych.,Warlord,yes,,Navida Prime,APK,b04c7003-0b7b-4954-b09c-088e0686d946,Overrun,35,7,7,,,,,,,,
518,,3,,62,1,3,,Dark Eldar,2,,Signature,Liatha's Retinue,,,"Reaction: After this unit is turned face-up, put it into play exhausted at a planet where no battle is taking place.",Assassin. Warrior. Creature.,Army,,4,Navida Prime,APK,2971cfb3-e6a5-4882-b9ee-7f198ebeda7f,Overrun,35,,,,,,,,,,
519,,,,63,,1,,Dark Eldar,,,Signature,Shadow Hunt,,1,"Reaction: After your opponent passes during the deploy phase, put a face-down non-Assassin, non-Elite [Dark Eldar] unit you removed from the game into play face-up at a target planet.",Tactic.,Event,,2,Navida Prime,APK,6ed1d9aa-86e5-4f2d-a38d-726807d8a326,Overrun,35,,,,,,,,,,
520,,,,64,,1,,Dark Eldar,,,Signature,Cloak of Shade,,3,"Attach to your warlord. Each unit at this planet loses Armorbane. While attached unit is defending, ignore the Armorbane keyword on enemy units. Forced Interrupt: When you use a card as a shield card, exhaust this attachment to have it gain 1 shield icon.",Wargear.,Attachment,,1,Navida Prime,APK,38f1bed2-4beb-4c8c-b876-727fe80c1221,Overrun,35,,,,,,,,,,
521,,,,65,,1,,Dark Eldar,,,Signature,Reveal the Blade,,,"As an additional cost to target this support, discard 2 cards at random from your hand. Combat Action: Exhaust this support and turn face-up a face-down card with no printed shield you removed from the game to give an army unit +2 ATK for its next attack this phase.",Skill.,Support,,1,Navida Prime,APK,4ee895d8-4fc5-4d28-a452-3d727f176ae9,Overrun,35,,,,,,,,,,
522,,,,66,,0,,Space Marine,,,,Woken Machine Spirit,,1,"Attach to a Vehicle unit. Limit 1 per unit. Attached unit gets +1 HP. Interrupt: When you use a shield card to prevent damage to attached unit, that card gains 1 shield icon. Then the shielded unit gets +1 ATK until the end of the phase.",Hardpoint.,Attachment,,,Navida Prime,APK,8ed4c338-880b-482e-bfb2-1375027ed987,Overrun,,,,,,,,,,,
523,,3,,67,1,3,,Space Marine,3,,,Thunderwolf Cavalry,,,"Reaction: After an enemy warlord commits to an adjacent planet with a single army unit you control, switch the location of that single unit with this unit.",Soldier. Space Wolves.,Army,,,Navida Prime,APK,4f86f181-ab33-402b-9d55-ac9212db35d5,Overrun,,,,,,,,,,,
524,,,,68,,1,,Astra Militarum,,,Loyal,Seal of the Ebon Chalice,,2,"Attach to an army unit. Attached unit gets +1 HP. Interrupt: When attached unit takes damage from a unit with a higher printed cost, deal to that unit damage equal to the difference between the units' printed costs.",Award. Ecclesiarchy.,Attachment,,,Navida Prime,APK,b8187e0e-531a-43aa-9e69-c31ad34a5fdc,Overrun,,,,,,,,,,,
525,,,,69,,0,,Astra Militarum,,,Loyal,Embarked Squads,,,"Command Action: Exhaust this support to have a target, non-Upgrade, Vehicle unit you control gain the Upgrade and Transport traits and 'Interrupt: When this unit retreats, put 2 Guardsman tokens into play at the same planet. (Limit once per phase.)' until the end of the round.",Location.,Support,,,Navida Prime,APK,942f4a0e-b3cf-4703-8031-f0fe383ff62a,Overrun,,,,,,,,,,,
526,,2,,70,1,2,,Eldar,2,,Loyal,Cegorach's Jesters,,,"Reaction: After a battle at this planet begins, your opponent may reveal any number of cards from his hand. He cannot use unrevealed event or attachment cards as shield cards during this battle.",Psyker. Harlequin.,Army,,,Navida Prime,APK,3313a8ca-85d7-41c7-94f4-f78980525c50,Overrun,,,,,,,,,,,
527,,,,71,,1,,Eldar,,,Loyal,Theater of War,,1,Play only if an enemy warlord is ready. Command Action: Exhaust your warlord to trigger the Battle ability of a target planet. Then your opponent may exhaust his warlord to trigger the Battle ability of another planet.,Power. Harlequin.,Event,,,Navida Prime,APK,d6611db3-cc1f-4ba5-94bd-04a6f1d8211b,Overrun,,,,,,,,,,,
528,,,,72,,0,,Ork,,,,Kwik' Konstrukshun,,1,"Combat Action: Put an [Ork] support with printed cost 3 or lower into play from your hand at your HQ. If that support is still in play at the end of the phase, discard it and draw a card.",Tactic.,Event,,,Navida Prime,APK,f30cffcd-65f7-41e0-abcf-471f5a23dd65,Overrun,,,,,,,,,,,
529,,2,,73,2,2,,Chaos,2,,Loyal,Cajivak the Hateful,,,"Interrupt: When damage equal to or greater than your warlord remaining HP are assigned or moved to your warlord, either (choose one): Put this unit into play from your hand at a planet, or discard this card from your hand to draw 2 cards.",Warrior. Khorne.,Army,yes,,Navida Prime,APK,390a7816-8efb-4a44-bda6-ef6c2489ee0f,Overrun,,,,,,,,,,,
530,,,,74,,0,,Chaos,,,,Scrying Pool,,1,"Attach to an army unit. Attached unit gains +1 HP. Interrupt: When you would discard a card from your hand as a result of an opponent's triggered ability, discard this card from your hand and draw a card instead. Then put it into play from your discard pile attached to an eligible unit, if able.",Blessing. Tzeentch.,Attachment,,,Navida Prime,APK,f135105c-05ae-4425-a93f-628567f49f57,Overrun,,,,,,,,,,,
531,,1,,75,1,2,,Tau,3,,,Gue'vesa Overseer,,,"This unit is an [Astra Militarum] unit in addition to [Tau]. Reaction: After this unit enters play, a non-[Tau] army unit at an adjacent planet gets +1 ATK and another gets +1 HP until the end of the game. (Each unit can be at a different planet.)",Soldier.,Army,,,Navida Prime,APK,7b7c12b7-da77-4bd1-91f3-4142faa17d65,Overrun,,,,,,,,,,,
532,,4,,76,,5,,Tau,7,No attachments,Loyal,Rampaging Knarloc,,,"While you have 4[Resource] or more, reduce all damage taken by this unit to 3. Reaction: After this unit is declared as a defender, exhaust it to deal 4 damage to the attacker.",Creature. Kroot. Elite.,Army,,,Navida Prime,APK,4fac8aef-7eb6-481c-85b2-0dec5e04e58f,Overrun,,,,,,,,,,,
533,,,,77,,1,,Tyranid,,,,Adaptative Thorax Swarm,,2,"Attach to an army unit. Attached unit gets +1 ATK and +1 HP per planet in your victory display. Reaction: After the first round begins, reveal this card and up to two cards from your hand, put them on the bottom of your deck in any order and draw the same amount of cards.",Biomorph.,Attachment,,,Navida Prime,APK,fff6b809-9cf2-4779-bd67-340f1bfd0660,Overrun,,,,,,,,,,,
534,,3,,78,1,3,,Tyranid,4,,,Erupting Aberrants,,,"Reaction: After your opponent captures a planet, destroy a target army unit and put this unit into play from your hand at the same planet under the control of the controller of the destroyed unit. Then if that unit had 1 or more attachments, pay 1[Resource], if able.",Hybird. Genestealer.,Army,,,Navida Prime,APK,112bde08-190a-41c3-82bc-d97fc8272c84,Overrun,,,,,,,,,,,
535,,0,,79,1,2,,Necron,4,No Wargear attachments.,,Parasitic Scarabs,,,"Interrupt: When you deploy a [Necron] unit, deal 1 damage to this unit and the deployed unit to reduce its cost by 1. Then discard the top card of your deck.",Drone.,Army,,,Navida Prime,APK,4fa95a02-a643-4ec3-8ce6-956905651a77,Overrun,,,,,,,,,,,
536,,0,,80,1,1,,Neutral,2,,,The Duke of Debris,,,"Interrupt: When you win a command struggle, instead of taking the card bonus search the top 2 cards of your deck for a card. Add it to your hand, and place the remaining cards on the bottom of your deck in any order. (Limit once per phase.)",Scavenger. Ally.,Army,yes,,Navida Prime,APK,8fa64b79-e7af-417e-964e-943ec8419c16,Overrun,,,,,,,,,,,
537,bloodied,1,,81,,,,Necron,6,Bloodied.,Signature,Imotekh the Stormlord,,,,Phaeron. Sautekh.,Warlord,yes,,,,,,,,,,,,,,,,
538,,2,,81,,,,Necron,7,,Signature,Imotekh the Stormlord,,,Action: Remove from the game a non-unique non-Elite card in your discard pile to replace the text box of a non-unique non-Elite card in play of the same type you control with the removed card text box until the end of the phase. (Limit once per phase.),Phaeron. Sautekh.,Warlord,yes,,Navida Prime,APK,2745a41d-81ac-4946-9074-a9cab3fab9d9,Aligned Stars,36,7,7,,,,,,,,
539,,3,,82,1,3,,Necron,3,,Signature,Court of the Stormlord,,,"Reaction: After this unit enters play, look at the top 3 cards of your deck. Put 1 on the top of your deck, 1 on the bottom of your deck and 1 in your discard pile",Soldier. Sautekh.,Army,,4,Navida Prime,APK,da6ec481-4492-48bb-8d34-9ec0ccf67afa,Aligned Stars,36,,,,,,,,,,
540,,,,83,,2,,Necron,,,Signature,The Strength of the Enemy,,1,"Combat Action: Until the end of the phase, replace the text box of an army unit you control with the printed text box of an enemy army unit at the same planet. Then treat that enemy unit text box as if it were blank.",Tactic.,Event,,2,Navida Prime,APK,f164262b-55f2-4d1d-b940-2778559478a7,Aligned Stars,36,,,,,,,,,,
541,,,,84,,2,,Necron,,,Signature,Supreme Strategist,,3,"Attach to a planet. Each Sautekh unit at this planet gets +1 ATK. Reaction: After the deploy phase begins, for each unit at this planet, its controller must choose to either rout it or exhaust it. Then discard this attachment.",Stratagem.,Attachment,,1,Navida Prime,APK,e2824036-35c0-45c4-aeb9-2792469106d4,Aligned Stars,36,,,,,,,,,,
542,,,,85,,1,,Necron,,,Signature,Sautekh Royal Crypt,,,"Reaction: After your opponent sets his command dial, exhaust this support to name a planet. If your opponent commits his warlord to that planet this phase, deal 1 damage to 1 enemy unit at that planet and each adjacent planet.",Location.,Support,,1,Navida Prime,APK,c17bcf40-ead3-4ad6-9dac-5a5684bbbc5a,Aligned Stars,36,,,,,,,,,,
543,,,,86,,2,,Space Marine,,,,Call the Storm,,1,"Attach to a planet. Combat Action: If there is no enemy warlord at this planet, exhaust this attachment to move a target enemy army unit at this planet to a planet with a Space Wolves unit you control.",Power. Space Wolves.,Attachment,yes,,Navida Prime,APK,8102c20e-da2f-49f5-b276-5e14b98d4bc7,Aligned Stars,,,,,,,,,,,
544,,3,,87,1,1,,Space Marine,3,,Loyal,Hjorvath Coldstorm,,,"While this unit is at a planet with an enemy warlord it gets -2 ATK, -2 HP. Interrupt: When your opponent triggers an ability that discards a card from your hand, put this unit from your hand into play at a planet. Then deal 1 damage to an enemy unit at that planet and draw a card.",Soldier. Space Wolves.,Army,yes,,Navida Prime,APK,ac1de8b0-8c52-4361-9e66-73ec30895af1,Aligned Stars,,,,,,,,,,,
545,,,,88,,3,,Space Marine,,,,Vamii Industrial Complex,,,"Limited. Reaction: After the combat phase begins, place 2 [R] on this support. Then you may sacrifice it to deploy a unit from your hand at a non-first planet, reduce its cost by the number of tokens on this support.",Location.,Support,,,Navida Prime,APK,e59b8a73-3948-460b-b6be-36b60264cb0b,Aligned Stars,,,,,,,,,,,
546,,1,,89,3,5,,Astra Militarum,12,No Attachments,Loyal,23rd Mechanised Battalion,,,"Cannot be targeted. Reaction: After the second combat round ends at this planet, if there is at least one enemy unit, retreat this unit to put 4 Guardsman tokens into play at this planet. Then deal 5 damage to this unit.",Corps. Transport.,Army,,,Navida Prime,APK,9a8c32f0-0095-47a1-a641-c8a767bbe8fe,Aligned Stars,,,,,,,,,,,
547,,2,,90,1,2,,Astra Militarum,2,No Wargear attachments.,,Armored Fist Squad,,,"This unit gets +2 HP while it is at a planet with a warlord. Interrupt: When this unit retreats, exhaust a non-warlord unit at this planet.",Vehicle. Tank. Transport.,Army,,,Navida Prime,APK,78f89b9b-ff59-416f-af1d-a0e4ac1433e3,Aligned Stars,,,,,,,,,,,
548,,3,,91,1,2,,Eldar,2,,Loyal,Luring Troupe,,,"Reaction: After you deploy this unit, move a target army unit at this planet to an adjacent planet. At the end of next phase, move that unit back to this planet, if able.",Psyker. Harlequin.,Army,,,Navida Prime,APK,449ac067-4bec-45bc-bae3-844e5d9b5c65,Aligned Stars,,,,,,,,,,,
549,,,,92,,1,,Eldar,,,,Flickering Holofield,,1,"Attach to an army unit. Attached unit gets +1 HP. Forced Interrupt: When attached unit is assigned damage, exhaust this attachment and prevent 2 of that damage. If it was already exhausted, ready it instead.",Wargear. Armor.,Attachment,,,Navida Prime,APK,97858675-6dc5-4acc-b335-3590bb1fd755,Aligned Stars,,,,,,,,,,,
550,,,,93,,0,,Tyranid,,,,Planet Absorption,,2,"Deploy Action: Gain 3 [R] and draw 3 cards. Then remove a planet in your victory display from the game. When this round ends or when another event named 'Planet Absorption' is played, you lose the game. Max 1 per round.",Tactic.,Event,,,Navida Prime,APK,dbbdd470-d491-4f3b-ad72-f5ee7e9c68e1,Aligned Stars,,,,,,,,,,,
551,,4,,94,1,5,,Tyranid,4,Deep Strike (3).,,Tunneling Mawloc,,1,"Reaction: After you Deep Strike this unit, move a non-Elite army unit you control or up to 4 Termagant tokens you control to this planet. Then infest this planet.",Creature. Kraken. Elite.,Army,,,Navida Prime,APK,312cd517-aaee-455a-a565-2b241b4f4cce,Aligned Stars,,,,,,,,,,,
552,,3,,95,1,3,,Ork,3,Deep Strike (2).,,Kamouflage Expert,,,"Reaction: After you Deep Strike this unit, a card in reserve at this planet or an adjacent planet is treated as a 3 ATK, 3 HP [Ork] army unit until the end of the phase.",Soldier.,Army,,,Navida Prime,APK,848e68ef-64ba-488f-911c-bac415f370a2,Aligned Stars,,,,,,,,,,,
553,,,,96,,1,,Ork,,,,Truck Wreck Launcha,,,"Interrupt: When a Vehicle unit you control leaves play, exhaust this support to deal 1 damage to an enemy non-warlord unit at the same planet. If this support was already exhausted, ready it instead.",Artillery.,Support,,,Navida Prime,APK,14da942b-f05b-4573-ac0a-a7dc7926c907,Aligned Stars,,,,,,,,,,,
554,,,,97,,1,,Chaos,,,,Medallion of Betrayal,,2,"Attach to a non-warlord unit. Attached unit gets +1 ATK and +1 HP, double if it is a Cultist. Reaction: After this card enters your discard pile, if you control no Cultist token, put a Cultist token into play at your HQ.",Wargear. Weapon. Slaanesh.,Attachment,,,Navida Prime,APK,99032a03-9266-4613-9bec-c718075cd599,Aligned Stars,,,,,,,,,,,
555,,1,,98,1,2,,Chaos,4,,Loyal,Sivarla Soulbinder,,,Each cultist token you control gets +2 ATK and +1 HP. Your cultist token limit is set to 2. Combat Action: Move a Cultist unit you control to a target planet. (Limit once per phase.),Daemon. Slaneesh.,Army,yes,,Navida Prime,APK,34369221-4b87-48ca-894a-275d3af3a09b,Aligned Stars,,,,,,,,,,,
556,,,,99,,1,,Chaos,,,,Cult of Khorne,,,"Interrupt: When a Khorne army unit enters play under your control, move 1 damage from a unit to this support. Then if this support has 2 damage on it, attach it to a unit as a Wargear attachment with the text Attach to an army unit. Attached unit gets +2 ATK..",Cult. Khorne.,Support,,,Navida Prime,APK,ef579b7c-e055-4255-8271-2d11f1f4553b,Aligned Stars,,,,,,,,,,,
557,,,,100,,1,,Tau,,,Loyal,Guerrilla Tactics,,2,"Command Action: Choose a planet with an enemy unit, your opponent loses [R] equal to the resource bonus and must discard cards from his hand equal to the card bonus. Then move a Kroot army unit you control at that planet to the first planet.",Tactic. Kroot.,Event,,,Navida Prime,APK,722afa48-a571-4ca0-875d-9e95b3b9080a,Aligned Stars,,,,,,,,,,,
558,,4,,101,,3,,Tau,2,,,Trap Laying Hunter,,,"Interrupt: When this unit is chosen as a defender, your opponent must choose to either deal 3 damage to the attacker or exhaust a unit he controls at the same planet. (Limit once per combat round.)",Kroot.,Army,,,Navida Prime,APK,c9f29624-a325-4e4e-92ed-ddabfb015453,Aligned Stars,,,,,,,,,,,
559,,1,,102,1,2,,Dark Eldar,2,,Loyal,Pain Crafter,,,"Reaction: After you play a [DE] event card, exhaust this unit to attach that event card to a [DE] unit as a Wargear attachment with the text Attach to an army unit. Attached unit gets +1 ATK and +1 HP.. (Limit once per phase.)",Scholar. Haemonculus,Army,,,Navida Prime,APK,2239407a-cdc8-4aa3-965a-dd1cb6af42a9,Aligned Stars,,,,,,,,,,,
560,,,,103,,1,,Dark Eldar,,Ambush.,Loyal,Torturer's Masks,,2,"Attach to an army unit. Attached unit gets +1 ATK and +1 HP. Reaction: After you use a shield card, if you have no cards in hand, exhaust this attachment to draw a card.",Wargear.,Attachment,,,Navida Prime,APK,ea5e1805-03e7-4f3b-9e6f-513108551a9d,Aligned Stars,,,,,,,,,,,
561,,,,104,,2,,Necron,,,,World Engine Beam,,,"Combat Action: Deal any amount of indirect damage that cannot be reduced or prevented to a unit you control to place or remove the same amount of [R] on this support. Each player may use this ability once per phase. Interrupt: When this support has 8 [R] on it, sacrifice it to destroy a non-unique unit, support or attachment.",World Engine.,Support,,,Navida Prime,APK,0d9aae61-65b8-42ae-aaa2-d5d93885318c,Aligned Stars,,,,,,,,,,,
562,,,,105,,0,,Necron,,,,Dynastic Weaponry,,2,"Attach to a N army unit. Limit 1 per unit. Attached unit gets +1 ATK. Reaction: After a unit enters play from your discard pile, put this card into play from your discard pile attached to that unit, if eligible.",Upgrade.,Attachment,,,Navida Prime,APK,fe20dc5c-b0df-4907-837e-37b31c41f1e4,Aligned Stars,,,,,,,,,,,
563,bloodied,2,,1,,,,Astra Militarum,5,Bloodied.,Signature,Broderick Worr,,,,Soldier. Commissar.,Warlord,yes,,Planetfall Cycle,FFG,,Decree of Ruin,,,,,,,,,,,
564,,2,,1,,,,Astra Militarum,6,,Signature,Broderick Worr,,,"Army units that retreat from this planet are destroyed instead. Each other [Astra Militarum] unit you control at a [STRONGPOINT] planet (green) gets +1 ATK and gains, 'Cannot retreat or be routed'.",Soldier. Commissar.,Warlord,yes,,Planetfall Cycle,FFG,f4746fbc-739e-4146-8bee-71d56102c769,Decree of Ruin,17,7,7,,,,,,,,
565,,3,,2,1,2,,Astra Militarum,3,,Signature,Anxious Infantry Platoon,,,"Forced Reaction: After a combat round at this planet ends, you may pay 1[RESOURCE]. If you do not, retreat this unit.",Soldier.,Army,,4,Planetfall Cycle,FFG,4c6c225c-7a3e-427f-b2e9-e62ca92d32d9,Decree of Ruin,17,,,,,,,,,,
566,,,,3,,2,,Astra Militarum,,,Signature,Forward Barracks,,,"Reaction: After a combat round ends, if you control an [Astra Militarum] unit at the planet where the battle is taking place, put 1 Guardsman token into play at that planet.",Location.,Support,,1,Planetfall Cycle,FFG,7c942a92-fb9c-49e3-8a63-802d57f677ae,Decree of Ruin,17,,,,,,,,,,
567,,,,4,,0,,Astra Militarum,,,Signature,Summary Execution,,1,"Play only during a battle. Combat Action: Sacrifice a unit at a planet with your warlord to have that planet gain a [STRONGPOINT] icon (green) until the end of the battle. Then, draw 1 card.",Tactic.,Event,,2,Planetfall Cycle,FFG,71c07865-b5e5-4eba-ac4a-66c477a7f5bf,Decree of Ruin,17,,,,,,,,,,
568,,,,5,,1,,Astra Militarum,,,Signature,Commissarial Bolt Pistol,,3,"Attach to a Commissar unit. Attached unit gets +1 ATK Reaction: After an army unit you control at this planet leaves play, deal 1 damage to a target army unit at this planet.",Wargear. Weapon.,Attachment,,1,Planetfall Cycle,FFG,6449d58f-51b1-406e-b9b2-1937e55b1fea,Decree of Ruin,17,,,,,,,,,,
569,bloodied,2,,6,,,,Tau,5,Bloodied.,Signature,Commander Starblaze,,,,Soldier. Shas'o.,Warlord,yes,,,,,,,,,,,,,,,,
570,,2,,6,,,,Tau,6,,Signature,Commander Starblaze,,,"You may include common [Astra Militarum] cards in your deck, but cannot include other out of faction cards. Reaction: After this warlord commits to a planet, move 1 [Astra Militarum] unit you control from an adjacent planet to this planet.",Soldier. Shas'o.,Warlord,yes,,Planetfall Cycle,FFG,b1c1286c-fd0d-4153-8bfe-814052da54ab,Decree of Ruin,18,7,7,,,,,,,,
571,,2,,7,1,2,,Tau,2,,Signature,Ardent Auxiliaries,,,"Reaction: After this unit commits to a planet, if you control an [Astra Militarum] unit at this planet, ready this unit.",Soldier.,Army,,4,Planetfall Cycle,FFG,1379e076-3f7a-436b-8b74-394106f114bc,Decree of Ruin,18,,,,,,,,,,
